{"activation_id":"aaaaaaaaaaaaaaaaaaaaaaaaaaaaaaaaaaaaaaaaaaaaaaaaaaaaaaaaaaaaaaaa","attempt":0,"binding_digest":"bbbbbbbbbbbbbbbbbbbbbbbbbbbbbbbbbbbbbbbbbbbbbbbbbbbbbbbbbbbbbbbb","inputs_b64":"eyJwYXRoIjp7InByb2plY3QiOiJQUk9KIn19","inputs_digest":"54f64b325c34e7183760570ea720dc3b4870e606aad13c641211d2f133b9ed9c","node_id":"call_api","schema_version":"elitea.runtime.http-action.v3","scope_ref":{"digest_sha256":"dddddddddddddddddddddddddddddddddddddddddddddddddddddddddddddddd","revision":1,"scope_id":"cccccccccccccccccccccccccccccccccccccccccccccccccccccccccccccccc"},"step":3,"thread_id":"e1:AAAAAAAAAAAAAAAAAAAAAAAAAAAAAAAAAAAAAAAAAAA"}